{
  "_meta": {
    "id": "0a505c7c11072812d9e5e08c",
    "author": "Example Org.",
    "email": "mail@example.org",
    "url": "https://example.org",
    "citation": "@misc{pfeiffer2020adapterfusion,\r\n    title={AdapterFusion: Non-Destructive Task Composition for Transfer Learning},\r\n    author={Jonas Pfeiffer and Aishwarya Kamath and Andreas R\u00FCckl\u00E9 and Kyunghyun Cho and Iryna Gurevych},\r\n    year={2020},\r\n    eprint={2005.00247},\r\n    archivePrefix={arXiv},\r\n    primaryClass={cs.CL}\r\n}",
    "description": "MNLI task adapter in Pfeiffer architecture for BERT base.",
    "default_version": "1",
    "files": {
      "1": {
        "url": "http://adapter-hub.webredirect.org/repo/files/bert-base-mnli-pfeiffer-v1.zip",
        "sha1": "37B93BA1EF3C7821F114FC792C590BD1548E9022"
      }
    },
    "task": "nli",
    "subtask": "multinli",
    "score": 0.90
  },
  "config": "pfeiffer",
  "hidden_size": 768,
  "model_type": "bert",
  "name": "multinli",
  "type": "text_task"
}